{
  "schemaVersion": 1,
  "receiptId": "cgb001-ws9-release-v1",
  "modelId": "nintendo-cgb-001-period-reconstruction",
  "classification": "acceptance-receipt",
  "referenceCondition": {
    "illuminant": "CIE D65",
    "illuminationAngleDegrees": 45,
    "viewAngleDegrees": 0,
    "runtimeAngleModel": false
  },
  "artifactHashes": {
    "docs/research/cgb-001-reference-survey.md": "c3da6164b44d269b3fffc2e52281a1d7db29bab44fb6e26689733d91ebbb79dd",
    "models/nintendo-cgb-001/IMPLEMENTATION-TODO.md": "8a2a0e9cff7a55ae98b4fae8a53cb55be54e3c2126cf613f9ac199d5ba458a31",
    "models/nintendo-cgb-001/README.md": "e3a6e942e82636a021c5690fe5b4fc6f857a775db462362ea6eb32628f768bc6",
    "models/nintendo-cgb-001/REFERENCES.md": "efb341fe48ba6923e840da1d2fe665a1406cc628d0d80217e36349b82a33e85d",
    "models/nintendo-cgb-001/data/aperture-v1.json": "74330cc3a0d8ce035eee930ab5f32321e9c4cfc116b69a5c3283d98504741dbe",
    "models/nintendo-cgb-001/data/aperture.schema.json": "32d58e730e3657ef3733f41b4d5b136e14c2441450f8d3b5179404997d38af21",
    "models/nintendo-cgb-001/data/color-model.schema.json": "50d9c4072caafd91e7fc3b382f13f22cb2aec56ce9528477c96ce7c833fdc8d5",
    "models/nintendo-cgb-001/data/color-reference-v1.json": "40c9ef3e0fce0a4d83670c5ab5544d1af9af22099ce88523788304ca0fa390be",
    "models/nintendo-cgb-001/data/exposure-integration.schema.json": "6c5f17086f03ca84aa6532d375eac49f26f4477623162bfd1db7e6ef1002c271",
    "models/nintendo-cgb-001/data/frontend-contract-v1.json": "6c54904c9b626140d0a91e2eea5d4e56877d1afeaa98c8ebc982277143ad37ae",
    "models/nintendo-cgb-001/data/frontend-contract.schema.json": "5b62d61dc9ee53f86fe5ed5f217b74a3a0c8e30cfc7a0656c88f3620a7402742",
    "models/nintendo-cgb-001/data/hcs-source-v1.json": "803829a1b02d9c2b0b664f632a211eb2b72cd9706645831f447fca954f79c9e1",
    "models/nintendo-cgb-001/data/measurement-normalization.schema.json": "3394a01bc6985fc174a568e3a2634426b2d476894bf7c1556c94e893855d3a08",
    "models/nintendo-cgb-001/data/reconstruction-v1.json": "f014b013356632b128c665f1453fb0616877f8ced62a706fd1c525f9b86e5261",
    "models/nintendo-cgb-001/data/release-receipt.schema.json": "f8520f74148e4e459a750b30b2736dc1594f90f061e7c2e210fae33bc96a5b0c",
    "models/nintendo-cgb-001/data/response-ensemble-v1.json": "33b355a0e70137dd1ad89ad677791f081a5fe869ca49e78130e64fdcbf18327a",
    "models/nintendo-cgb-001/data/response-ensemble.schema.json": "330931be2e1aaf8f8a8fbd565953b57664d8a215adef59b048ef6b1f10ba34ca",
    "models/nintendo-cgb-001/data/retention-v1.json": "22bdc901e1a78ae85cdc16018d09976289384b819dc3d43a6fdb6da5dcc60f08",
    "models/nintendo-cgb-001/data/retention.schema.json": "e31cdfb4da339d2da763bff35666576ed7257f8876a125c3317721fc85ce385d",
    "models/nintendo-cgb-001/data/scan-candidates-v1.json": "3f33ea131d3fbf09ea00f673cfa6300986bc0456246adae6d2c19c493035c663",
    "models/nintendo-cgb-001/data/scan-candidates.schema.json": "d33e28b8ee53e89d3aabe4befda25745d3eeeda7f65736b61eaf6498f92bcd3b",
    "models/nintendo-cgb-001/data/ws2-frontend-policy-v1.json": "615cb447898d3b8d6ef46f9fcf6766e27755f18f93d51ca39fd445bf4365cad4",
    "models/nintendo-cgb-001/data/ws2-stimulus-scenes-v1.json": "3c8013b4bd6726db8ec79bc1e4d57eb3e9f144d4079f6e8e7846ce73c2a1ac1c",
    "models/nintendo-cgb-001/data/ws3-evidence-inventory-v1.json": "d6cb6f41b8cbe12f6e726c14977033d52089a39deac54854c34fa661196689f2",
    "models/nintendo-cgb-001/data/ws4-evidence-inventory-v1.json": "21aeb8b44de0e1fe7c7bc1edc56c3467148e618a3a499c29f311b5000d31d081",
    "models/nintendo-cgb-001/data/ws4-response-policy-v1.json": "8844a572b314d30b0cf3305ce5a8d4740fd64478a614ab6d434691405f276b40",
    "models/nintendo-cgb-001/data/ws5-exposure-policy-v1.json": "dae6038390dac6baa107328005b981b1c7671eca4adc46de164191366bb06279",
    "models/nintendo-cgb-001/data/ws6-evidence-inventory-v1.json": "6cc2ee07aa540c125354f53fbedc9aab36e83604724f8811b072f5245f85eb62",
    "models/nintendo-cgb-001/data/ws7-evidence-inventory-v1.json": "9824452c596df03ed2bdb4e7ad5be886be76ef8bd784e9159ea32374866f640b",
    "models/nintendo-cgb-001/generated/cgb001-d65-lut-v1.json": "3705d681547e1d99ac90cc7e8980e2512690c3711faf3ffd060ab039b47635f9",
    "models/nintendo-cgb-001/generated/cgb001-d65-lut-v1.rgba32f": "273f1bf7f11c0952f7fabfac42822d0a80b199d37073171f142d1aed2fb42e4f",
    "models/nintendo-cgb-001/generated/cgb001-hcs-upstream-d65-v1-hi-rgba8.png": "d112ed5e679ea1d220951bd9c5baff6df19e96ff87e8c72404ebbe8d64a5491d",
    "models/nintendo-cgb-001/generated/cgb001-hcs-upstream-d65-v1-lo-rgba8.png": "d103e494d82206e1ea66151d1ef7c5b786dce5d2892b25e232ba608d802f602c",
    "models/nintendo-cgb-001/generated/cgb001-hcs-upstream-d65-v1.png": "bb2f20e1181c42284d7adc8de97d84b2101a0ec85e86fca13c8185a5fc2ecb4e",
    "models/nintendo-cgb-001/generated/cgb001-reference-d65-v1-hi-rgba8.png": "223a496f4371312271f212b5052d13228c95c9f0510feba72ba9df6e97d1d5eb",
    "models/nintendo-cgb-001/generated/cgb001-reference-d65-v1-lo-rgba8.png": "2a959ae5e8bd459c906bc8cbf12cf74bb5bae5ee71affc061f06fd71103e4339",
    "models/nintendo-cgb-001/generated/cgb001-reference-d65-v1.png": "87924d6e3691049660ad9a9f51ee1cf8ad3a6fec913ab9ec713f6b5116e3a713",
    "models/nintendo-cgb-001/generated/cgb001-ws4-gtg-rates-v1.json": "9c19d667fa49f576c6524d3a28cc97dad3a58a7cfa116a12674b8b7ce92fa0d2",
    "models/nintendo-cgb-001/generated/cgb001-ws4-gtg-rates-v1.r32f": "a43e901fbb103c578d1b26263057148d9ab8524507b5d826309879e50fb0ecf9",
    "models/nintendo-cgb-001/generated/ws0-scaffold-v1.json": "d5c5742af394b4a82c9ea8d0f1394454111274629f31ad152c4288d62e961ce5",
    "models/nintendo-cgb-001/generated/ws1-color-audit-v1.json": "599cec6ed7b5cc8a23b5592846c294833452ba07dfdcd29c631a90c566dd970b",
    "models/nintendo-cgb-001/generated/ws1-perceptual-v1.json": "43beed991bff443f5c790ba23f05d00648fc26b5bba530bbbfc1cba918d3ed19",
    "models/nintendo-cgb-001/generated/ws1-receipt-v1.json": "a4c2b652e678d7f127151533e057e1b54001423741f0def42077dd4f49e8d080",
    "models/nintendo-cgb-001/generated/ws1-static-fixtures-v1.json": "600dd5c7f3153301a4131410b91800d80b72d877c05ed34d1150d9c33b8a0bc7",
    "models/nintendo-cgb-001/generated/ws2-decoder-v1.json": "bdf47eef8306185b8783e1cd5aeaddef44283f5c4542a8f67a63233ae8471344",
    "models/nintendo-cgb-001/generated/ws2-gambatte-smoke-v1.json": "bc572655172dec8e6bc9cef3b1e1d3cc47f3678784194566697f34a1c08de2c1",
    "models/nintendo-cgb-001/generated/ws2-receipt-v1.json": "b60b74798d4adc658fd61f4627133b46c37c4264b7ffd554982b898a95ce2ac2",
    "models/nintendo-cgb-001/generated/ws2-stimulus-v1/alternating-lines.gbc": "7433ffe8e47924a0755c5901d521363af9bee45e4f6f1b786e0c07a6e4b03bd0",
    "models/nintendo-cgb-001/generated/ws2-stimulus-v1/blue-ramp.gbc": "eee240263c137577a739b53576f0dd26f67d6c08cb2a72c62d071fe86377d42a",
    "models/nintendo-cgb-001/generated/ws2-stimulus-v1/checkerboard.gbc": "bf447d86674600e5d6fa3a4e851db36436b4748ca54776df2b5fcf2b3affb177",
    "models/nintendo-cgb-001/generated/ws2-stimulus-v1/color-corners.gbc": "9ac84e295eef6d3d8e5b1d81e43081176e6d6720afe9640c3891cb26f61543f3",
    "models/nintendo-cgb-001/generated/ws2-stimulus-v1/first-last-row-change.gbc": "3ccb5e5a19b41580d5bca00eec2c55a509eedbcf99c4c697613894bb74a1df35",
    "models/nintendo-cgb-001/generated/ws2-stimulus-v1/gray-ramp.gbc": "f1077ef5dd0e310cc0582bcfb483f0793f55d5351b56f3c02c15362afd1bb226",
    "models/nintendo-cgb-001/generated/ws2-stimulus-v1/green-ramp.gbc": "84bd9878fe5277013c80e2d4988de132d1df0a63bedc577aa2fa55a224fdacee",
    "models/nintendo-cgb-001/generated/ws2-stimulus-v1/isolated-window.gbc": "e157062e9ce3fdda97be284ffbd9a606f6ae71d61a322dcb2f8bdcd077093592",
    "models/nintendo-cgb-001/generated/ws2-stimulus-v1/manifest.json": "ff0a61f131b40da9ca74b56c837617200edc86090aba8c8285265c9e257d83ad",
    "models/nintendo-cgb-001/generated/ws2-stimulus-v1/mixed-patches.gbc": "f2cfaef762544679cdb207523a5f631c935f13a775fc1cd8a942c484fc9d3a68",
    "models/nintendo-cgb-001/generated/ws2-stimulus-v1/moving-edge.gbc": "27ab1d35fafc9aed6a8550b991ecea65cf98c58a0aa03b08a46b8deedad8f3b8",
    "models/nintendo-cgb-001/generated/ws2-stimulus-v1/parity-toggle.gbc": "65a05978587b0b797979238aa216a8779764ffe31af23f56ae3e008fdea6961b",
    "models/nintendo-cgb-001/generated/ws2-stimulus-v1/pixel-grid-identity.gbc": "ba5ecf3d528154fb677f00a255ac81e196d28f42dfbca812b7a056c129c161dd",
    "models/nintendo-cgb-001/generated/ws2-stimulus-v1/red-ramp.gbc": "343b03008d1214beedd82e0a98d79c3403e758d1ff919f46e6cd5bcc1a487508",
    "models/nintendo-cgb-001/generated/ws2-stimulus-v1/retention-stress-recovery.gbc": "ae121eaae5e62de6942da85ba1036ef5f1c53f4f062cca194ea3bf43945d93ca",
    "models/nintendo-cgb-001/generated/ws2-stimulus-v1/rgb555-exhaustive-transport.gbc": "72e42558d723f895ccea0634939d2cd80364b68ae959dff5942904a5c2bfc664",
    "models/nintendo-cgb-001/generated/ws2-stimulus-v1/row-markers.gbc": "c2da01637c84c2d7dd9a006c29b177c78cc5b22e0ece7d57416a9df9496ec672",
    "models/nintendo-cgb-001/generated/ws3-equation-vectors-v1.json": "a3f8e39890036dcb44ff846249ec9d36a5b1c5c0eb824dda64bc9a2fa9081dce",
    "models/nintendo-cgb-001/generated/ws3-receipt-v1.json": "13c427e4322535103444a61d25e792cbd0b5da40bcad835b08677e56e0d865d3",
    "models/nintendo-cgb-001/generated/ws3-runtime-constants-v1.json": "590e2972d359f9af3a8d99ae7a4cd07e2eaf0223eec50451d38a731bd7782c95",
    "models/nintendo-cgb-001/generated/ws3-sensitivity-v1.json": "9a788516244806e0615c8c3183297f6068815bacf3b3ce44f5439929c510a473",
    "models/nintendo-cgb-001/generated/ws4-equation-vectors-v1.json": "aa69f19e083970eaa52c6a3c60bf602a179db260d3af35733772c8a19cbb2f90",
    "models/nintendo-cgb-001/generated/ws4-model-selection-v1.json": "c6e27a23da7a82ae55f9952372ad78e946a33bfa045adecebff2ab9ddcbe7095",
    "models/nintendo-cgb-001/generated/ws4-motion-fixtures-v1.json": "8221aa8a7d002514b1a7cbf0bf81280f8d5337d30bae7410d5b5c015f829a45d",